{
  "$schema": "https://anthropic.com/claude-code/marketplace.schema.json",
  "name": "yuuki1036-claude-plugins",
  "description": "Custom Claude Code plugins by yuki",
  "owner": {
    "name": "yuki"
  },
  "plugins": [
    {
      "name": "code-review",
      "description": "Phase 0 トリアージ + 動的エージェント構成のコードレビュー。confidence × severity の 2 軸で報告閾値を制御し、diff の性質と effort に応じて explorer → reviewer → 反証レイヤーを構成する。PR レビュー（/review）とコミット前セルフレビュー（/self-review。--embed で他プラグインから委譲可）に対応。",
      "version": "2.162.2",
      "author": {
        "name": "yuki"
      },
      "source": "./code-review"
    },
    {
      "name": "dev-workflow",
      "description": "Git 操作・PR 作成・UI 動作確認・バグ診断・worktree 並列環境セットアップの開発ワークフロー。原子性重視のコミット、承認ゲート付き PR 作成、chrome-devtools MCP による UI 自動化、feedback loop 駆動の 6 Phase バグ診断、worktree 単位の DB / port 分離を提供する。",
      "version": "1.39.1",
      "author": {
        "name": "yuki"
      },
      "source": "./dev-workflow"
    },
    {
      "name": "harness-keeper",
      "description": "Claude Code自体の設定管理・改善ツール。セットアップ推奨、CLAUDE.md監査・改善（骨抜き禁止/三段防御/階層 AGENTS.md/@AGENTS.md 参照運用/優先度規約/静的検査優先の 6 パターン強化）、CCアップデート追従、セッション学習の反映、eval 回帰テスト（トリガーフレーズ → 期待スキル起動を pass^k で検証）、新コンポーネント追加前判断（skill/agent/hook/command 追加前の退路確保）",
      "version": "2.0.1",
      "author": {
        "name": "yuki"
      },
      "source": "./harness-keeper"
    },
    {
      "name": "issue-workflow",
      "description": "Issue 管理ワークフロー（旧 linear-workflow / indie-workflow の統合後継）。backend（local / linear）をデータディレクトリから自動判定し、Issue 作成・セッション開始・棚卸し・knowledge 蓄積・課題自動発見（discover）・振り返りまで一貫サポート。issue 作業の全散文成果物に writing-polish 推敲を必須連携。却下記録（kind: rejected）で見送り提案の再提案を discover が概念類似照合で抑止。",
      "version": "1.14.0",
      "author": {
        "name": "yuki"
      },
      "source": "./issue-workflow"
    },
    {
      "name": "plugin-manager",
      "description": "インストール済みプラグインの一括更新と、ほぼ全部 install しているマーケットプレイスの後発追加プラグイン取りこぼし通知（SessionStart hook）",
      "version": "1.9.1",
      "author": {
        "name": "yuki"
      },
      "source": "./plugin-manager"
    },
    {
      "name": "plugin-feedback",
      "description": "プラグインへの改善要望・バグ報告を GitHub Issue として作成。コマンドと自然言語の両方で起動",
      "version": "1.4.0",
      "author": {
        "name": "yuki"
      },
      "source": "./plugin-feedback"
    },
    {
      "name": "feature-dev",
      "description": "コードベース理解・アーキテクチャ設計・runtime smoke test・品質レビューを 8 phase で進める機能開発ワークフロー。code-explorer / code-architect の 2 agent を内包し、型・テスト・lint の決定的オラクルゲートを高コストレビューの前に置く。Phase 6 は code-review:self-review へ --embed 委譲する。",
      "version": "2.26.2",
      "author": {
        "name": "yuki"
      },
      "source": "./feature-dev"
    },
    {
      "name": "notebooklm-workflow",
      "description": "NotebookLM 連携ワークフロー。URL/PDF/YouTube/Drive のソース追加と既存ノートへの Q&A・要約取得を自然言語で操作（jacob-bd/notebooklm-mcp-cli を .mcp.json で同梱）",
      "version": "0.2.10",
      "author": {
        "name": "yuki"
      },
      "source": "./notebooklm-workflow"
    },
    {
      "name": "guardrail-protect",
      "description": "git commit の hook 迂回（--no-verify/-n・git 省略形・-c core.hooksPath 上書き・変数間接・sh -c スクリプト内）を常時ブロック + lint/hook/static check 設定ファイルの骨抜き編集を opt-in でブロック + gh の外向き書き込みで実在しない見出しへの参照・隔離なしの hook スクリプト実行・公開リポジトリ/gist への業務情報送信（辞書とホスト名で照合・宛先は visibility で判定・fail-closed）・zsh で壊れる Bash の書き方（$VAR:修飾子・path/status 代入・語頭の =・引用なしグロブ）・gh run list --commit への短縮 SHA をブロックする PreToolUse hook。config 自己保護・fail-loud 付き",
      "version": "0.9.2",
      "author": {
        "name": "yuki"
      },
      "source": "./guardrail-protect"
    },
    {
      "name": "doc-freshness",
      "description": "ドキュメント鮮度の機械強制。last-validated / phase frontmatter による stale 検出、行数ガード、internal link 検証、新規 doc grace period 対応。.claude/adr・.claude/designs・.claude/living-specs も走査し append_only: true で append-only 履歴文書の stale 判定を免除。PostToolUse hook で frontmatter 欠落を非ブロッキング検知、SessionStart hook（opt-in）で stale を一括通知",
      "version": "0.5.5",
      "author": {
        "name": "yuki"
      },
      "source": "./doc-freshness"
    },
    {
      "name": "bdd-spec",
      "description": "BDD spec 駆動の scaffold + 評価プラグイン。create で user story dir + epic.md / spec.md 2ファイル粒度 + 同値分割表 + 状態遷移表（stateful のみ）テンプレを生成し、evaluate で構文/粒度/網羅性（同値分割表⇔Scenario 双方向トレース）/トレーサビリティ/遷移カバレッジ（状態遷移表⇔Scenario、stateful のみ dormant）の 5 観点を severity×confidence で静的レビュー",
      "version": "0.3.7",
      "author": {
        "name": "yuki"
      },
      "source": "./bdd-spec"
    },
    {
      "name": "adr-keeper",
      "description": "設計判断 (ADR) を append-only で蓄積。YYYYMMDDhhmmss 秒精度命名、適用方法セクション必須化、supersede 時の新規作成+旧 ADR 4フィールド更新（status/phase/superseded-by/last-validated）を機械化。append_only frontmatter で doc-freshness の stale 判定を免除。new 時は記録価値 3 条件セルフゲート（覆すコスト大 × 文脈なしで不可解 × 実在のトレードオフ、supersede 経由は除外）で ADR の希釈を防止。スキルを通さない ADR の新規 Write は PreToolUse hook が id・命名・必須見出しを検査して止める。",
      "version": "0.4.2",
      "author": {
        "name": "yuki"
      },
      "source": "./adr-keeper"
    },
    {
      "name": "failure-journal",
      "description": "再発する失敗を JSON Lines に append し、30日×3回閾値超えのパターンを retro で抽出して AGENTS.md/hook/skill へ還流。retro は transcript を走査して未起票の失敗もサルベージする。SessionStart で journal 初期化、failure:logged を event bus に publish",
      "version": "0.9.0",
      "author": {
        "name": "yuki"
      },
      "source": "./failure-journal"
    },
    {
      "name": "writing-polish",
      "description": "文章を語句レベルで推敲・添削する。最小差分の diff 提示 → 採否フローで、冗長削り・曖昧語の具体化・トーン統一・AI っぽさ除去を行う。過剰修正の抑制を中核原則に置き、textlint があれば日本語の決定的チェックを併用する（日英対応）。散文とコードコメントを自動判別し、--embed で他プラグインから委譲できる。",
      "version": "0.10.2",
      "author": {
        "name": "yuki"
      },
      "source": "./writing-polish"
    },
    {
      "name": "design-doc",
      "description": "技術設計書 (design doc) を実装に入らず作成・永続化する。grill で前提確定→代替案比較→.claude/designs/ に保存。実装ブリッジ必須化と supersede 機械化で死に文書化を防ぐ。4視点 agent の設計レビュー (design-review) を同梱（confidence フィルタ + high 以上で敵対的反証 phase）",
      "version": "0.6.0",
      "author": {
        "name": "yuki"
      },
      "source": "./design-doc"
    },
    {
      "name": "spec-advisor",
      "description": "開発タスクの内容から適切な設計・計画系成果物（WHAT=bdd-spec / HOW=design-doc / WHY=adr-keeper / Issue粒度=issue-design / 実装一気通貫=feature-dev）を判断し、実装着手前に提案する。判定の SSoT を routing-rubric に一元化し、SessionStart hook で ambient ルールを注入（対象プラグインが1つも未導入なら inert）＋ spec-advise skill / command で明示起動の2経路。over-suggestion guard で bugfix/typo/設定変更には黙り、dormant 判定で未導入プラグインは提案肢から除外する。全連携先 optional でプラグイン独立",
      "version": "0.1.9",
      "author": {
        "name": "yuki"
      },
      "source": "./spec-advisor"
    },
    {
      "name": "living-spec-workflow",
      "description": "【deprecated → project-hub】living spec は project-hub に統合した（/update-all が自動で移行する）。Issue 化前の設計収束ドキュメント (living spec) を作成・運用する。",
      "version": "0.7.3",
      "author": {
        "name": "yuki"
      },
      "source": "./living-spec-workflow",
      "_superseded_by": "project-hub"
    },
    {
      "name": "project-hub",
      "description": "1 つの PJ の決定と段取りを 1 つのプラグインで持つ。決定は living spec（repo の .claude/living-specs/。OQ 台帳と Decision log を append-only で持ち、確度ラベル・phase・先送りで収束を追い、maintain が 8 段で検証する）、段取りは hub（1 つのセッションを hub にして、複数の sub で進める PJ の状態をコンテキストの外のファイルで持つ。sub を起動でき、lead の確認が要らない連絡は承認なしに送り、宛先は送る直前に引き直す）。hub のセッションには SessionStart / PostCompact で状態の表を、UserPromptSubmit で未取り込みの知らせを注入する。living spec だけ・hub だけでも使える",
      "version": "0.8.1",
      "author": {
        "name": "yuki"
      },
      "source": "./project-hub"
    }
  ]
}
